{
  "$schema": "https://json-schema.org/draft/2020-12/schema",
  "$id": "https://repo2gal.dev/schemas/asset-pack/v1.json",
  "title": "Repo2Gal Asset Pack v1",
  "type": "object",
  "additionalProperties": false,
  "required": [
    "manifestVersion",
    "name",
    "version",
    "displayName",
    "description",
    "authors",
    "license",
    "profiles",
    "assets",
    "provenance"
  ],
  "properties": {
    "$schema": {
      "type": "string",
      "const": "https://repo2gal.dev/schemas/asset-pack/v1.json"
    },
    "manifestVersion": {"const": 1},
    "name": {
      "type": "string",
      "minLength": 1,
      "maxLength": 128,
      "pattern": "^(?:@[a-z0-9][a-z0-9._-]*/)?[a-z0-9][a-z0-9._-]*$"
    },
    "version": {"type": "string", "maxLength": 128, "format": "semver"},
    "displayName": {"type": "string", "minLength": 1, "maxLength": 160},
    "description": {"type": "string", "minLength": 1, "maxLength": 1000},
    "authors": {
      "type": "array",
      "minItems": 1,
      "maxItems": 32,
      "items": {"$ref": "#/$defs/author"}
    },
    "license": {"$ref": "#/$defs/packageLicense"},
    "homepage": {"type": "string", "format": "uri", "maxLength": 2048},
    "repository": {"$ref": "#/$defs/repository"},
    "keywords": {
      "type": "array",
      "maxItems": 32,
      "uniqueItems": true,
      "items": {"type": "string", "minLength": 1, "maxLength": 64}
    },
    "locale": {"type": "string", "maxLength": 128, "format": "bcp47"},
    "profiles": {
      "type": "array",
      "maxItems": 8,
      "uniqueItems": true,
      "items": {
        "enum": [
          "repo2gal.palette",
          "repo2gal.theme",
          "repo2gal.character",
          "repo2gal.audio",
          "repo2gal.chronicle",
          "repo2gal.complete"
        ]
      }
    },
    "theme": {"$ref": "#/$defs/theme"},
    "assets": {
      "type": "object",
      "maxProperties": 256,
      "propertyNames": {
        "pattern": "^[a-z][a-z0-9]*(?:\\.[a-z][a-z0-9-]*)+$",
        "maxLength": 160
      },
      "additionalProperties": {"$ref": "#/$defs/asset"}
    },
    "provenance": {"$ref": "#/$defs/provenance"}
  },
  "$defs": {
    "author": {
      "type": "object",
      "additionalProperties": false,
      "required": ["name"],
      "properties": {
        "name": {"type": "string", "minLength": 1, "maxLength": 160},
        "url": {"type": "string", "format": "uri", "maxLength": 2048}
      }
    },
    "repository": {
      "type": "object",
      "additionalProperties": false,
      "required": ["type", "url"],
      "properties": {
        "type": {"const": "git"},
        "url": {"type": "string", "format": "uri", "maxLength": 2048}
      }
    },
    "licenseBase": {
      "type": "object",
      "additionalProperties": false,
      "required": ["spdx"],
      "properties": {
        "spdx": {"type": "string", "maxLength": 512, "format": "spdx"},
        "file": {"type": "string", "minLength": 1, "maxLength": 512},
        "copyright": {"type": "string", "maxLength": 1000},
        "source": {"type": "string", "format": "uri", "maxLength": 2048},
        "attribution": {"type": "string", "maxLength": 2000},
        "retrievedAt": {"type": "string", "format": "date-time"},
        "evidence": {"type": "string", "minLength": 1, "maxLength": 512}
      }
    },
    "packageLicense": {
      "allOf": [
        {"$ref": "#/$defs/licenseBase"},
        {"required": ["file"]}
      ]
    },
    "asset": {
      "type": "object",
      "additionalProperties": false,
      "required": ["type", "file", "mimeType", "sha256"],
      "properties": {
        "type": {"enum": ["background", "character", "bgm"]},
        "file": {"type": "string", "minLength": 1, "maxLength": 512},
        "mimeType": {
          "enum": [
            "image/png",
            "image/jpeg",
            "image/webp",
            "image/avif",
            "audio/mpeg",
            "audio/ogg",
            "audio/wav",
            "audio/flac",
            "audio/mp4"
          ]
        },
        "sha256": {"type": "string", "pattern": "^[0-9a-f]{64}$"},
        "width": {"type": "integer", "minimum": 1, "maximum": 32768},
        "height": {"type": "integer", "minimum": 1, "maximum": 32768},
        "character": {"type": "string", "minLength": 1, "maxLength": 80},
        "emotion": {"type": "string", "minLength": 1, "maxLength": 80},
        "framing": {"$ref": "#/$defs/characterFraming"},
        "loop": {"type": "boolean"},
        "license": {"$ref": "#/$defs/licenseBase"}
      },
      "allOf": [
        {
          "if": {"properties": {"type": {"enum": ["background", "character"]}}},
          "then": {
            "properties": {"mimeType": {"pattern": "^image/"}},
            "required": ["width", "height"]
          }
        },
        {
          "if": {"properties": {"type": {"const": "character"}}},
          "then": {"required": ["character", "emotion"]}
        },
        {
          "if": {"properties": {"type": {"const": "bgm"}}},
          "then": {"properties": {"mimeType": {"pattern": "^audio/"}}}
        }
      ]
    },
    "characterFraming": {
      "type": "object",
      "additionalProperties": false,
      "required": ["mode", "top", "bottom", "centerX"],
      "properties": {
        "mode": {"const": "upper-body"},
        "top": {"type": "number", "minimum": 0, "maximum": 1},
        "bottom": {"type": "number", "minimum": 0, "maximum": 1},
        "centerX": {"type": "number", "minimum": 0, "maximum": 1}
      }
    },
    "theme": {
      "type": "object",
      "additionalProperties": false,
      "properties": {
        "palette": {
          "type": "object",
          "minProperties": 1,
          "maxProperties": 32,
          "propertyNames": {"pattern": "^[A-Za-z][A-Za-z0-9]*$"},
          "additionalProperties": {"type": "string", "maxLength": 256, "format": "css-color"}
        },
        "typography": {
          "type": "object",
          "additionalProperties": false,
          "properties": {
            "body": {"type": "string"},
            "heading": {"type": "string"},
            "code": {"type": "string"}
          }
        }
      }
    },
    "provenance": {
      "oneOf": [
        {
          "type": "object",
          "additionalProperties": false,
          "required": ["sourceType", "createdAt"],
          "properties": {
            "sourceType": {"const": "manual"},
            "createdAt": {"type": "string", "format": "date-time"}
          }
        },
        {
          "type": "object",
          "additionalProperties": false,
          "required": ["sourceType", "repository", "revision", "retrievedAt"],
          "properties": {
            "sourceType": {"const": "git"},
            "repository": {"type": "string", "format": "uri"},
            "revision": {"type": "string", "pattern": "^[0-9a-fA-F]{40,64}$"},
            "retrievedAt": {"type": "string", "format": "date-time"}
          }
        },
        {
          "type": "object",
          "additionalProperties": false,
          "required": [
            "sourceType",
            "provider",
            "model",
            "generatedAt",
            "promptFile",
            "providerTerms",
            "termsRetrievedAt"
          ],
          "properties": {
            "sourceType": {"const": "ai-generated"},
            "provider": {"type": "string", "minLength": 1},
            "model": {"type": "string", "minLength": 1},
            "generatedAt": {"type": "string", "format": "date-time"},
            "promptFile": {"type": "string", "minLength": 1},
            "seed": {"type": ["integer", "string"]},
            "providerTerms": {"type": "string", "format": "uri"},
            "termsRetrievedAt": {"type": "string", "format": "date-time"}
          }
        }
      ]
    }
  }
}
